Time,Text
27:54,this whole chatbot development process you have a dialog which is a conversation from conversation you are
27:59,extracting two things intent entity an intent is mapped to some
28:05,python function ndte is nothing but the argument to that python function
28:10,all right by default you get two intents in dialog flow so I clicked on intents
28:16,and I'm seeing these two okay what are these exactly let me check welcome intent here
28:23,there are couple of sections there is contacts events training phrases and tax
28:29,response let's look at training phrases first here it says
28:35,what are the possible prompts that are accepted as
28:40,part of that intent so when here on the top when I say hey yeah
28:46,it is saying greetings how can I assist and you see it matched the intent default welcome intent so whenever I say
28:54,here it will look into the current list of intents and based on the training
28:59,phrases that you have provided it will match that and this response that you're saying
29:05,greetings how can I assist is coming from here you see so in the tax response you have this four possible options and
29:12,randomly it will give you different tax responses so let me try another one I
29:18,will say howdy okay and it will say good day what can I do
29:23,so you can see that here see so you understand I am typing some text
29:29,in chatbot it is matching it with all the intent so I have two intense default
29:34,welcome and default uh fallback and it is matching it with the welcome intent and whatever is the response for the
29:40,welcome intent it will give you that in our chat board we want to start a
29:46,conversation by saying choose from New Order and track order so I will change
29:52,the default welcome intent and I will keep this particular thing same you can say hi hello to begin the
29:58,conversation but in the response I will remove all these
30:03,and I will say this in the second response is just a
30:09,variation by the way so every time you don't want to say the same thing that's why you are giving
30:15,three different variations so user get different experience all the time okay when I hit save sometimes it will take
30:22,some time so you need to wait a little bit now when I say hey yeah
30:28,see it is giving you one of these responses what can I do you can say New Order or track order and by the way all
30:35,these responses I copied from the text file which you can download by clicking on uh the link which you have in a video
30:42,description I have given a zip folder with all the assets and if you expand
30:48,that folder it will be zip file and if you extract that zip file you will get
30:54,this particular directory in that go to dialogflow assets opentraining phrases
31:00,Dot txt and that file has all the three text which I just copy pasted okay that
31:06,is for default welcome intent okay now
31:13,this looks good what I want to do next is
31:18,let's go back click here and check fallback intent
31:23,in the fallback intent uh the purpose of this intent is if
31:29,chatbot doesn't understand what you're saying it will give one of these responses so if you say what is the
31:37,temperature today okay that's not the purpose of this chat but the chatbot
31:42,doesn't know how to handle that it will say sorry could you say again and that is coming from here see one of these
31:49,responses it will randomly pick from one of these responses so what you want to do here is I want to delete all of these
31:56,okay so let me delete and in the default fallback intent
32:02,I want to say this so in the fallback intent I want to say
32:08,I did not understand what you said please choose from New Order or track
32:13,order and when you're placing new order by the way make sure you're you're placing order from only these items
32:20,because remember our menu is limited we have only nine items food items so we
32:25,want to say this to user so that they are kind of guided in their conversation I will hit save and now when I say what
32:34,is the temperature it will say I didn't understand look I don't know how to handle that temperature question but I
32:42,can take your order so you can say the New Order track order and you know whatever okay so my default intent and
32:52,my welcome intent looks good now let's create our first intent which is
32:59,create an intent which is New Order so it is New Order so when you're placing a new order
33:06,uh what kind of uh text you will give okay so let's try it so first you will
33:12,start your conversation in your chat about saying hi it will tell you new order or track order what do you think user will say
33:18,user will either say New Order or track order they might say New Order okay so
33:23,you want to have this as a training phrase here so you can click on ADD training phrases
33:30,and add this as a new order now what else user might say okay they
33:36,can say place a new order maybe okay they might say let me just copy yeah I I
33:43,just put two things here New Order and place New Order if you are looking for more training responses uh what you can
33:50,do is you can go to chat GPT and you can say say this in five different ways and
33:56,chat GPT will help you generate those training phrases and you if you have more training
34:02,phrases it's going to help you okay so it is advice that you have uh as many
34:09,training phrases as you can
34:15,okay uh now let's try this thing so I will say hi and it will say New Order I
34:23,will say New Order okay I have seen that chadji uh not
34:29,charging dialogue flow sometimes takes us time so there is a delay here uh it
34:34,is kind of training the agent uh so once it is trained maybe I will just wait for few seconds and then we'll we'll try
34:41,okay let's try again so see now it worked it is saying New
34:46,Order so here it matches the intent so here you are typing whatever you will type in uh your chatbot then it is
34:53,matching the intent here and if you have any response it will
34:58,give you a response here so what do you want to give in a response so let's add that so here in the text response I want
35:06,to say this okay and once again you have this file folks
35:12,so feel free to copy paste things from the file and then once you learn of course you can have your own responses
35:19,so here when someone says New Order I want to say starting a new order I I'm
35:25,meaning the chatbot and you will guide people so it's it's important that while building a chat board you do some
35:32,guiding you have to give them Clues on what they should type next that way the
35:38,conversation will be very clear so now we have new order so let me start all
35:44,over again and by the way uh I will talk about context later but let's see hi okay and now it is saying
35:51,New Order so you'll say New Order now it is saying see this thing you can start a
35:57,new order by saying things like I want two pizzas one mangola C also specify quantity because you want user to
36:04,specify quantity sometimes they say I want pizzas but how many peas are if you call a pizza shop they will tell you
36:10,right so same thing should happen here you need to Clearly say specify quantity for each of these items okay so once
36:18,again these are the two uh alternate responses uh so at any time
36:24,it will just kind of randomly say see here now it is saying starting a new order all right this looks good now
36:31,let's create the tagging order I only have the board build so I just copy copy
36:37,paste the name here just to save the time okay so track order so tracking
36:43,order will be our new intent and here in the tracking order what are the training phrases so once
36:50,again I'm just going to copy paste from here so you will say one of these three
36:55,things okay so check this status of my order
37:03,that could be one thing then the other one is track order and
37:10,track existing order once again if you want to add more training faces you can say to charge gpts how about
37:17,this and it will generate five different variations so maybe you can include one of these variations I'm feeling lazy
37:24,right now so I'll just say done and when someone says I want to track my order what would be your response as a chat
37:31,board you'll ask for a tracking ID correct okay so let's let's see let's
37:37,start again so I will say hey it is saying New Order or track order when I say track order
37:44,see it is okay once again it it is taking I've seen this it is taking time
37:50,so let's wait for few seconds a few moments later all right after some delay it is working now when you set track
37:57,order it is matching the track order intent but what should be your response your response should be what is your
38:04,tracking ID give me your tracking ID things like that so let's add that in the text response here you can say what
38:11,is the tracking ID or lesser order ID
38:18,uh other things
38:23,you can say I can just copy paste from the other chatbot which I have already built I'm sure please enter your order
38:32,IDs things like that once again you can use chat GPT for this training purpose all
38:40,right now let's test the whole flow again you are saying hi it is saying New Order track order you're saying track
38:47,order now enter your order ID and you will say whatever 4560 whatever now this
38:53,one it is not recognizing so we will look into this a little later but at least now my intent classification is
39:02,done for these two use cases it is able to recognize if I'm talking about tracking the order on New Order
39:09,okay so once again uh you can say fresh order and see it is recognizing it is
39:14,New Order you're talking about new order you can say track my order please
39:21,and okay sometimes I know it behaves weird
39:27,it depends on adding more training phrases but it will look good overall and it is doing this intent
39:34,classification so the question might be how does it work exactly whatever you're typing here uh it doesn't have to be
39:41,exactly the same thing that you gave as a training phrase so there is some kind
39:47,of machine learning here which dialog flow uses so let me go over that what
39:52,happens is um when you give some training phrases so for New Order I gave three training
39:59,phrases New Order Place New Order and fresh order Okay Google's dialog flow
40:04,will generate more training phrases internally so these are the three I gave but internally by using ml model it will
40:12,generate more training phrases and it will train an agent so that tomorrow if someone types something different it can
40:18,still recognize same thing if you say tracking order let's say these are the three training phases I give internally it will which
40:26,create more training phrases and it will train the agent once the agent is trained
40:32,when you give any new text in the chat board on the top right when I say order status please
40:39,the ml model for intent classification will kick in and it will try to classify
40:45,this particular text in one of these indents so you are essentially doing intent classification here
40:52,and it will say you know what this is track order intent for a different use case it will say
40:57,this is a new order intent so this way it can do intent classification using
41:05,its internal model and if you want to know more about it you can just go to
41:11,chatgpt and you can say what classification model does
41:16,dialog flow uses for intent classification and it will give you some
41:24,information okay so see here it is using irm like intent
41:31,recognization model uh and here it uses some of the annual natural language
41:37,understanding techniques for doing that so you can do some reading on this one but so far
41:44,uh things are looking good as far as our basic basic workflow is concerned now
41:49,let's improve uh some of our intents and add new ones let's look at the flow of the
41:56,conversation so if you go back to our presentation okay you will notice that
42:03,at some point we had this different scenarios so the first scenario that we had was this how can I help New Order
42:10,what would you like to order uh we covered up till this point now user will say I want to power bhaji
42:18,and add pizza so let's handle this particular dialogue and for that I will
42:25,create a new intent called order dot add so you are adding items to order
42:33,okay so we did first level classification New Order track order now if you have a new order you are adding
42:40,items to the order and how do you add that I will have to give different training expiration okay and those
42:47,training expressions are user might say give me two plates of show layer and one
42:54,cheese piece I know you're getting water in your mouth but ah now let's check this what is
43:02,happening here is 2 and 1 it is already recognizing them as a entity which is
43:10,very good so 2 and 1 are called system entity sys DOT number these are default
43:16,entities for example email phone number these are all generic entities which dialog flow can recognize on its own
43:23,okay let's give another training phrase what do you do where by the way when you
43:29,place an order online what kind of statement you say just add all those statements here I like to order two
43:35,plates of chole one cheese pizza three mango let's see now in this case it did
43:40,not recognize this one as a CIS number but that's okay you can double click and
43:46,you can just say sis number see these are all numbers so let's
43:52,recognize this also as a CIS number and here we want this to be one single
44:00,entity so here it says number one and two I don't want that so you will just
44:06,left Mouse click highlight it and just say sis number and you can also type
44:11,this this DOT number see this is how you assign entities within the statement so
44:18,I have these two uh training phrases let's hit save and let's create an
44:24,entity for food item because see the quantity it is already recognizing but
44:30,food item is something that we have to Define on our own for that I will go to entities
44:35,I will create the new entity I will call it food item
44:41,and I will Define synonyms I will do also fuzzy matching by the way fuzzy matching means
44:47,if it is Loosely matching then also you know match it so see for Z matching is a
44:54,type of parameters which will approximately match and here the entity
45:00,that you want to add is let's say I only have those entities here so I'm
45:08,just gonna copy paste just to save some item uh time on recording so how would you say
45:14,you can say you can also say Mumbai maybe Mumbai
45:22,foreign
45:32,you can just say chole you can say
45:39,C double actually you can say chole Puri instead of you
45:45,can also say Puri chole okay variety of synonyms that you can
45:52,give all right so I'm not going to waste the time here and I will just add it and
45:57,I'll be back after few seconds okay there was some manual work but
46:04,finally I have defined all my synonyms once again you can use chat GPT for
46:10,synonym let's say you want synonyms for ravados I give me synonyms for our Dosa
46:18,and it will give you that so you can just copy paste these things into here and just hit this
46:26,okay now our food item entity is defined let's go back to intent and in the order
46:34,add let's start assigning that entity so here just left Mouse click
46:41,assign that a food item so I will just say this is food item
46:47,cheese pizza is also a food item mango let's see is also a food item this is
46:55,how you assign and it is same thing here you have to do this in every training
47:00,phase if you do your setup in a proper way your chat board will work very
47:06,smoothly so you have to be careful and not mess it up here sometimes people assign a wrong entity and they see weird
47:13,results and they are like oh this is not working well it's a setup issue I added
47:18,all the training phrases you can see there are two Page worth of training phrases here
47:24,and I assign the food items here so here you'll just click on it for
47:31,example like click and then when you assign that entity it will do the work
47:37,so many times when you're adding a training phase it will not automatically
47:42,recognize those two so the way you do it is same method highlight it then just
47:49,select food item then highlight the whole item safe food item this is how you assign
47:55,entities in your statements if you notice I also put some additional
48:01,statements such as additionally I would like to add to Mango nursing because in the conversation people will say order
48:07,me to chole bhature and one Samosa and then after some time they say Okay add
48:13,to pizza or additionally I need mango let's see I have added those kind of
48:18,statements here as well in the same intent you can go to chat GPT you can
48:24,say this is my phrase and say this in five different ways and you can use all
48:30,of these training phrases as well it will be some manual work but trust me it is very well worth it and all of these
48:37,training phrases are available in the file that I'm going to give you so all you have to do is copy paste and maybe
48:42,you add a couple of more training phrases as well on your own then hit
48:49,save and now we are all set how do you test it well you have the agent here so
48:56,let's start a conversation you'll say hi New Order and then just say give me two
49:07,and one plate of samosa and now see what happened is it first of
49:15,all recognized that as order dot add intent so that part worked
49:21,pretty well also in terms of parameter see food item whatever Dosa and Samosa were recognized
49:27,as a food item and two and one were number
49:33,after doing this you can say hey add one mango let's see two
49:40,and see once again order dot add one mangola C so mangoes is recognized as a
49:47,food item and one is a number you can see the entire response uh in terms of
49:53,your Json API response this is something we'll be using when we write our fast API backend but here you can see food
49:59,atom is Mangalore C this is one and so on so this is working as expected now
50:07,what can happen is the conversations are not perfect they will say hey add pizzas
50:14,well but how many pizzas they didn't specify it okay and here
50:20,see the chatbot is not smart enough it should say how many pizzas you want okay
50:25,or specify food quantity for this you have to make both of these a required
50:32,parameter okay so here go down here and just make them require parameter and if
50:38,they are not specifying any parameter you need to have a prompt you can say
50:45,please clearly specify a food quantity
50:52,and you can just give example uh you know I want
50:57,two pizzas or three chole but or you can say it using
51:04,word you don't have to specify the number all the time so that is the prompt
51:13,for the food item you can say please
51:19,specify food item from this list and that list is the list we can get it
51:27,from the default intent I think okay uh not not default I think in new DOT
51:34,order we supplied that list so you can say please specify
51:40,it from this list now when say hey add pizzas
51:46,I previously forgot to save it so whenever you are adding something make sure you hit the save now when I say hey
51:52,add pizzas it will say please specify the food quantity and without that it's
51:58,not gonna work you can say hey I want three Samosa but let's say I've forgot
52:04,to write samosa I want 3 what
52:10,okay if I want three Samosa okay somehow it's recognizing this as a food item
52:17,Pizza by default I don't know why it is doing that but let's take another example I want two plate of Pani Puri
52:28,so we don't have panipur in our food menu so now it is saying please specify the food items from this list because it
52:35,did not get the food item and because of the prompt that you have it is giving
52:41,that guidance to the user so far it looks good now let's discuss something
52:46,very important called context let's say you have conversation like this new
52:52,order or track order and directly you say remove whatever your chat board will be confused what are you talking remove
52:58,whatever from where so human conversations will always have
53:03,a context context means whatever I previously said you need to have that in memory and then when I say new thing you
53:11,need to relate that to what I said previously so here here remove what a pound doesn't make any sense but if the
53:19,same conversation is like this see New Order what would you like to have what about to Biryani what else now
53:26,when I say hey remove whatever that makes sense because you have a clear context
53:33,so we need to define the context in dialog flow here when I start a new
53:39,order your context is New Order you can Define it in any possible way I'm going
53:46,to give the name ongoing order this context name you can whatever it can be
53:52,ABC whatever name you want to give I will say it is an ongoing order context
53:57,when you start a new tracking that is an ongoing tracking
54:04,so in that ongoing order you can have other intents such as you might add
54:10,things to your order you might remove things from your order when you have ongoing tracking you might give multiple
54:18,tracking IDs but let's say if your context is ongoing tracking and if you say hey remove it upon that doesn't make
54:24,sense board will be confused so whenever you say statement like hey remove word upon one word upon to Biryani it has to
54:31,be in this kind of context okay so we already defined a new order and Order dot add intent so
54:40,that is that is this is order dot add intent but this has to be in the context ongoing order
54:46,remove should also be in the context ongoing order so let's define these
54:52,things here in in our dialog flow in the way I do that is whenever you are
54:58,starting a new order in the context you have input context and output contacts so in the output
55:05,context you will say ongoing order see it's just a simple text you type in and
55:11,this Phi means conversation turns lifespan for how many iterations meaning
55:16,when I say hey how are you uh hello whatever that is one conversation done
55:23,for example this is one conversation done okay boat end user that is bad that
55:29,is one this is another conversation term this is third conversion term Phi is
55:34,good enough if you want to edit it you can just go and say seven okay I'll just keep this as a default value ongoing
55:40,order so that is the context whenever you say new order for example look at this whenever you say New Order you are
55:48,starting that new context that's why it is in output context but when I come to this intent okay adding an order my
55:56,ongoing order context is already set so it will be input as well as output
56:02,context so let's let's do that uh here you can hit save and then go to your
56:09,order ad and in both input and output context it will be ongoing so ongoing
56:15,order and ongoing order okay because after you say air three Biryani
56:20,you can say just add two mango let's see you can keep on adding one by one that's why it is in the output as well and when
56:28,you do that you will see that context appearing on the right hand side so let's do that so I'll say hey then I
56:35,will say New Order when I say New Order the context is ongoing order now I will
56:41,say I want two pizzas and the context is still
56:47,ongoing order okay so you can keep on adding that now let's add uh the order
56:54,dot remove intent so here I will say order dot removed because you might
57:01,potentially remove and now now we will use a different uh different convention which is whenever
57:09,you are adding any intent which also has a context so here there will be ongoing order context
57:17,okay input and output both so whenever you have context in your intent I will say context
57:24,colon ongoing order this is just a naming convention I am using okay nothing
57:30,nothing fancy here as such and the same thing I will now change order dot add
57:36,and I will say context ongoing order
57:41,okay whenever you see this uh rotating uh cogwheel you have to wait because
57:47,it's kind of training and that was the reason some some of the times these things don't work you have to wait till
57:53,the this rotation is complete okay so I have now total four intents these two
57:59,have context set in it okay what's gonna happen in a remove context let's add
58:05,some training phrases once again to save the time I will use my
58:12,I'll just copy paste things from here uh so let's say this and now you'll realize that it is auto
58:20,recognizing this in Samosa as one of the entities so I will do I will add all of
58:27,this and we'll be back after some time
58:33,I also assigned the entities most of it was assigned already but if it doesn't
58:40,then make sure you are just highlighting and assigning it in the response you can say
58:46,removed Dollar food item hit save and I'll show you what happens
58:53,due to this when you say remove Pizza it will say pizza remote okay so I can say remove
59:00,Samosa for example and it will say remove Samosa so that is what happens when you give this kind of text response
59:07,what I did is just to save time on recording I already added the other intents which was tracking order for
59:14,example right so here uh the context I have defined it as ongoing tracking
59:20,which will be set whenever you are placing a tag order see output context is ongoing tracking then here I think in
59:28,the tax response you should say what is your order ID so I have added all of those things here and here in the file
