Time,Text
0:01,post 2010 this is going to be the decade of e-commerce
0:01,post 2010 this is going to be the decade of e-commerce
0:07,Ben Pandey runs a traditional Eatery in the city of Mumbai
0:13,Mr Pandey wants to improve his income by listing it in platforms like zwigy and
0:19,somato he thought this will fix his fortune but he gets dejected
0:25,both platforms rejected his application a budding data professional decides to
0:33,step up and help his Uncle Ben Pandey Peter is a go-gadget he sat on a mission
0:42,he decides to build a chat board for his Uncle Ben's Eatery
0:48,in fact he succeeded in building one the first small step towards a giant lead
0:56,[Music]
1:06,thank you I am going to take you along Peter's journey of building this chatbot
1:12,step by step we will first configure our chatbot in dialogflow then we will write
1:17,a back-end server in Python using fast API web serving framework this will
1:23,interact with mySQL database so we will be placing orders retrieving order information from this database and once
1:31,all of this is done we will integrate this chatbot to our food website this
1:37,will be truly end-to-end project which will not only help you learn a lot of
1:42,diverse skills required in building a chat board it will also give you a solid
1:48,project that you can put on your resume first on your emails and get ready for the ride review the problem statement
1:56,we have this food website Pandey fresh and delicious foods and here if someone
2:02,comes on the website it will show all the items so right now it is selling
2:07,only nine items these are all yummy items chole Samosa mango let's see and so on and a person can get an idea on
2:15,the price location they can even call to inquire but they don't have any technology as such and what we want to
2:23,do is we want to build a chatbot and integrate it on this particular website
2:29,so that you know the chatbot appears on the bottom right and a person can say
2:36,New Order or track order so now let's say if I'm saying new order it will show me all the items which are available and
2:43,I can then say give me two bav bhaji one pizza all the junk food and it will kind
2:50,of review whatever you have added in the cards so far then you can add let's say
2:56,one mango let's see you can even remove an item you can say well you know these
3:01,are too much uh I want to remove let's say pizza in the chat Port you look at
3:06,it chatbot is smart it is remembering the context and it is having this list where you can add items and remove items
3:14,eventually when you say that's it it knows that you're completing an order
3:19,and it will say okay we have placed your order this is the bill and so on so we are going to implement this and this
3:26,will insert a record through our backend in our mySQL database and it will handle all this conversation I am calling this
3:33,a Mira chatbot you know all these companies have fancy names Ino Julie uh
3:40,Alexa all these chatbot names I came up with this name Mira uh so Meera will be
3:45,the chatbot that we are going to build now you can have a different scenario where a person might say I want to track
3:52,an existing order after placing an order what happens is in the kitchen Chef will
3:57,prepare it then it will be delivered so here see order number 41 is in transit
4:02,meaning order has started from the restaurant and it is on the way previously it was uh in progress the
4:10,previous order so it can give you all that status when you say okay Pani Puri
4:15,I did not understand it will tell you that we do not support these items we can only order from all these nine items
4:22,so it will have all these uh fancy features okay so first thing we are doing now is we are scoping down our
4:30,work when I worked in Industry at Bloomberg and Nvidia business managers would come up with big projects and they
4:37,will have so many features that they would want to implement but when you start any project in the first phase you
4:43,don't Implement all the features you have to scope it down so here is a huge
4:49,list of requirement you come up with the initial set of features that you're going to implement and this is called
4:56,scoping your work okay in our case we have variety of features when it comes
5:03,to New Order one can place a new order you can also support paying through a
5:09,chatbot for that order the example that I showed you previously in the chatbot it was cash on delivery but you know a
5:15,business user will say okay why don't you support credit card or debit card payment in your chatbot you can also
5:22,have tracking features you can track by order ID Track by phone number Track by customer name you can have other
5:28,features as well such as offers and store hours and so on now you will
5:35,review these features with business by you I mean the data scientists or ml
5:40,Engineers who are working on this project so there will be engineering team or data scientist team there are a
5:45,business team they will have conversation they will do negotiation they will say hey this feature will take one month this feature will take five
5:52,days uh which one you want to pick and business will come up with their most desired items okay so they will say Okay
6:00,I want to implement these two items placing a new order and tracking the order and that decision is dependent on
6:08,two factors one is how important is that feature second thing is feasibility uh
6:13,there is a term called feasibility impact analysis let's say this feature is very important supporting payment through a chatbot business will say yes
6:20,this is very important but data scientists will say well it will take two months then that feature has a high
6:26,impact but low visibility on the other hand you can have a feature which is very high feasibility but low
6:34,impact for example store hours implementing store hours is a piece of cake you can implement it in half a day maybe
6:42,but it doesn't have too much impact okay so you want to Target those features
6:48,which has high impact high visibility and after a closed room discussion
6:53,between business stakeholders and data scientists they decided these are the two features which we should Implement
7:00,in our first round so what we had initially was all these
7:06,features if you put it in a flat vertical list this is called your backlog
7:11,folks when you're preparing for data science or NLP career make sure you
7:17,don't learn only technical things you need to understand the fundamentals behind project management agile
7:23,methodology stakeholder management and so on backlog is a popular term when it comes
7:30,to Agile way of building projects backlog is nothing but all your wish list all the feature you want to build
7:36,then after you had that discussion which I already talked about you came up with
7:41,these two features and they are called MVP minimum viable product which is your
7:48,phase one in phase one I want these two features and you can use tools such as jira notion Asana
7:56,etc for doing this kind of project management right now I just showed you all this in my slide but when I was at
8:02,Bloomberg we were using jira there are companies which is using a notion for
8:08,example in my own company right now we use notion as a project management tool I have used Asana as well these are all
8:14,awesome tools and they help you more manage your project they help you define your backlog your MVP and so on and then
8:22,once your MVP is defined your data science team will work only on these two they will not look at all these they
8:28,will keep this in mind because these features they will Implement in phase two phase three and so on but their
8:34,immediate Target is these two features once these two features are out now you will have minimum viable product which
8:42,is your first version which you can deploy you can test with users users
8:47,will give you some feedback after the feedback some of your backlog items will change because business is dynamic it's
8:54,always changing it's not like okay my manager told me to implement this 10 feature and I will keep on implementing
9:00,this for next one yet no as you deploy a MVP in production your current backlog
9:05,will change based on the feedback you're getting from People based on changing demands from the business so in phase
9:12,two then you can pull some more features from backlog so you'll continue adding
9:17,or deleting items from backlog and you will pull the features from backlog to here okay so read online about agile
9:25,methodologies scrum way of doing project development there is a great website called scrumtraining series.com if you
9:32,want to learn about scrum all right so now we have these two features that we
9:37,are going to implement in this particular video so in throughout the video we are building this particular MVP so now let's think about solution
9:44,design and architecture when you get a project and when you have a scope of work clearly defined see so far we have
9:51,clearly defined scope of work I want to build a chatbot put it on my website
9:56,chatbot should support two features placing a new order and tracking order bet order ID as a data science team you
10:03,know exactly what you're building now comes the phase where you will Define the technical architecture or the
10:09,solution usually in the companies uh when I was working in an industry and even in my company what we do is we get
10:16,together in a conference room and there will be team of data scientists who will
10:21,brainstorm the solution uh let's say if you call a student if you're learning or even if you're working as a data
10:27,scientist you have a great consultant right now who is available to you for
10:32,free all the time and that consultant is chat Deputy yes chat GPT can give you a
10:39,complete solution design here I am saying I have a fast food business I want to build this our chatbot and I
10:46,want two features New Order and track order okay chat GPT will give you a
10:52,complete design step by step and the suggestion that it is giving is actually pretty good okay it's not like bluffing
11:00,so it is saying you need to First use dialog flow it's a NLP platform
11:06,it will understand input and generate responses then you need to use node.js
11:12,for backend you can have MySQL as a database uh you can use express.js as an
11:19,interface and web interface okay it is giving you one possible solution that you can use in our case we are not going
11:26,to use node.js Etc because we like Python and we would like to do this in
11:32,Python and fast API uh so we will use that but in chat GPT I'm pretty sure if
11:37,you say I don't want to use node.js I want to use Python show me an alternative approach it will tell you
11:44,that particular Pro so I would say let's try it out okay so while you're watching the video maybe pause it and just try it
11:50,out and see the solution steps it has given it's pretty darn amazing okay
11:57,once you get all these steps you can also say can you tell me step by step
12:02,process of implementing this in dialog flow because dialog flow is just one component so then it will say okay these
12:09,are the steps and by the way don't worry about these steps I'm just showing to you so that tomorrow if you work on any
12:14,NLP or machine learning project you can use chat GPT or to come up with all
12:20,these steps and it will tell you okay Define intent Define fulfillment and so on so let's go over this process step by
12:27,step first thing we did is we Define scope of work we had new order tracking
12:33,order billing query store hours and we said we'll Implement only two things New Order and tracking order second one is
12:39,chat board platform selection see chat GPT gave dialog flow but when I was
12:44,talking to my friend he told me why do you use Amazon Alex then I did Google Google told me rasa and dialogflow and
12:51,five other platforms I am now confused I don't know what to use so you have to do
12:56,some research to figure out which platform is the best one for you and
13:02,there are no general answers there are specific answers for your specific need
13:07,dialoflow might be better for a need of some other team rasa might be better so it's like dependent on the individual
13:14,situation therefore you as a NLP engineer or a data scientist need to
13:21,learn how to pick a right platform for your given project or a problem then we
13:27,are going to obviously in this project use dialogflow I will tell you how I pick dialogflow and why I didn't use rasa in dialogflow we have to set up
13:34,something called intent and fulfillment we'll go into the details okay don't worry I know these are all jargons this
13:41,is all actually very easy I will tell you later on then we will build back-end and we will do it in Python and fast API
13:47,on this channel there is a fast API tutorial which you can watch and get your fundamentals clear but yeah that's
13:54,what we are doing we are not using node.js Etc and then in the end we will integrate this chat board into our
14:00,website all right now how did we pick up dialogflow as a platform for this
14:06,particular project so see there are two options whenever you are building any chatbot you can use our readymade
14:14,framework such as dialogflow rasa Etc or you can go for custom implementation where you can use things like open AI
14:21,llms hugging face Bloom foundational model and so on in our case what we want to do is we want to get some help from
14:28,the export and once again that expert is chat GPD so in chatgpt you can say okay
14:34,which platform is better initially I also asked questions should I use open Ai and build the boat it says no doesn't
14:41,make sense that we use open AI so now I'm saying okay dialogue flow and rasa
14:47,which one is better and it will create a comparison table between both the platforms and when I look at it what I
14:54,find is dialog flow gives lot of features out of the box so you have to do less work see here my business is
15:02,facing problem I want to build a chatbot fast and release it soon so time to Market is my first priority although
15:09,rasa gives lot of customization time to Market is not as high as dialogflow time
15:14,to Market means how much time you take to ship your product which is chatbot in
15:20,this case to Market how much time you take to complete this project that is time to Market and it's a very important
15:27,parameter training data since dialogflow is a Google's platform it has vast amount of training data here you have to
15:34,do some manual training a dialogflow is cloud-based so directly you can upload it to Cloud uh here rasa you have to
15:41,build it and you have to kind of host it on your own okay uh so let's see other
15:48,differences Integrations uh once again dialogflow provides better integration
15:53,so if you read this carefully by that I'm not gonna go into all these one by one you can read this and you will
16:00,realize yourself that dialog flow is better for our use case uh we did not use open ai's llm Etc because our
16:08,problem is not like a generative AI type of problem our problem is user is
16:14,placing an order he's asking for tracking Etc it's like very specific actions and for that dialog flow is the
16:20,best then I got some confidence that dialog flow is something I should use
16:25,but I still want to do more research just to get a confirmation that I am making a right choice so naturally I
16:32,would think which companies use dialog flow if dialogflow is not used by uh other companies then it means it would
16:38,have some problem so this is what I do I I always make sure the technology I'm using is mature it is stable it is used
16:46,in the industry okay then I am not doing experiments for that company okay here I
16:51,ask this question and it immediately tells me Domino's is using dialogflow Ticketmaster Air Asia there are so many
16:59,companies which are using dialog flow after reading that after confirming
17:04,these companies are using it I am now damn sure that I have confidence on dialogue flow I can go
17:12,ahead and use it for my project all right let's move on to the next step which is I'm saying this graph folks so
17:17,many people are watching my videos they are not subscribed if you can subscribe to this channel it will mean a lot to me
17:24,it might be a small thing for you but it's gonna make a huge difference in your life all right now let's do our
17:30,dialog flow setup I type dialogflow in Google it is taking me to this
17:36,particular website and here uh it has information on two different versions of
17:42,dialogflow which is CX and Es all right and now I am again confused which one is
17:48,better for my needs okay and these two versions are actually a lot different uh
17:54,in the way they work and they have this featured uh list and when I compared it
18:00,I did not get much idea so what I did is again I went to my consultant friend
18:05,chat GPT I said look I want to build this chatbot I want to have just two
18:11,features my budget is limited you need to tell your conditions your situation to chargpt can you suggest me which is
18:17,better and it is saying dialogflow yes is better because number one cost cost
18:23,of es is much lesser compared to CX if you look at CX uh their pricing is I
18:30,think it's it's bit costly per I think of 10 chat session they charge something
18:38,like two dollar which is kind of costly so I will go with es and you can just
18:45,compare other uh factors why GPD saying you should use ESN not CX okay
18:54,so once you say I have dialogflow es ready to go you can just click on go to
19:00,console or you can just type directly dialogflow.cloud.com
19:06,you will have to login using your Google credential if you don't have a Google account you need to create it and once
19:12,you create that account see let me open this in uh in cognitive mode
19:18,it will say sign in using Google so here you can sign in and then you will come
19:25,here okay now there is this concept of agent so I have
19:30,already built this chat board so it is showing this but let me create a new one so here
19:36,I will say create a new agent so new agent is essentially your new chatbot okay and here my chatbot name is mira
19:44,mira chatbot for food delivery I know it's a long name
19:51,but whatever and then I can just say create
19:56,so when you create this it will use uh Google a cloud actually so this project
20:02,is already on the cloud you are not building locally by the way you are already building this particular
20:08,project on the cloud so it already created a Google Cloud project so if you
20:13,go to settings here uh this is the project ID on Google Cloud
20:18,if you have used Google Cloud before you will get what I'm talking about but anyways my agent or my kind of basic uh
20:25,framework for my chatbot is ready and if you look at intents it has two intents
20:31,so before I go here let's understand what exactly is the intent let's
20:38,understand intense by going over some examples I use this bank called PNC Bank here in
20:45,us and when I call them for any help usually they will give me pre-canned
20:51,list of options such as you want to check your payment recent activity low star stolen card this is not new I think
20:59,you must be experiencing these things for your banking needs and
21:04,these are short of like a fixed pre-can option that you can choose from and
21:10,these five are nothing but the intent okay so let's say if you have an NLP chatbot and it says how can I help you
21:17,you might say I want to make a payment then it will ask you a few other
21:22,questions make a payment here is an intent when a person is coming to a chatbot they might have different intent
21:30,or intention such as they want to make a payment they want to check their balance
21:35,they want to report a stolen card or lost card these are intent so it's a
21:40,fancy word folks but actually you know what this is It's like a main function it's like what do you want to do so you
21:46,have this natural language English from that you want to derive or you want
21:53,to map that sentence with specific action that your back end should take
21:59,okay so that is your intent in another conversation you might say
22:04,can you check my recent activity here checking recent activity is an intent whatever I have outlined here these five
22:11,things these are intent in our case you will say Okay Place me a new order
22:19,so placing New Order is an intent then you can say I want to add two pav Bhajan
22:25,one pizza so when we design the backend you will get more better understanding adding these items into your order is
22:32,also an intent okay then you can say I want to add mango let's see that is intent so these two are same intent this
22:40,is a different intent this is like a pure beginning a new order whereas you are adding items to existing order and
22:46,when you say that's all you mean complete my order so that is your intention I want you to complete my
22:52,order and tell me how much money you are going to charge me so that is order
22:58,complete intent I hope it is clear you can pause this video If you're not
23:03,getting it it's really a simple concept then boot will say okay I place your order in scenario two you might also say
23:11,hey remove Vada power from my order so removing Vodafone okay that means you
23:18,are intending order remove okay so order removes kind of like a function or
23:23,intention uh you might say hey please get rid of pizza you might use a
23:30,different word okay you can say remove it up how get rid of pizza I don't want Biryani all of these mean
23:38,the same intent which is order removed so in dialog flow we will map this we
23:45,will map different English sentences that you can use for a specific intent
23:50,so we'll say these 10 sentences mean this specific intent and don't worry it's a NLP tool so it's not like you
23:57,have to specify all possible options it will figure out using its NLP capability
24:02,then you can say Okay track my order okay here the intent is track order okay
24:10,so it's just a mapping between what user says and what action will be taken by a chat board or your backend now let's
24:17,understand the concept of entity folks if you are following the NLP playlist you already know what entities are but
24:25,let's look at entities in our uh context so here when you say add to pav bhaji and one
24:33,pizza to the order let's say if you make this call to a backend python backend
24:38,python backend got an idea that all right you want to add few items to the
24:45,order but what are those items here the items are pav bhaji and Pisa and the
24:50,other thing that it wants to know is what is the quantity of these items so
24:56,quantities two and one so here these two things are needed so that you can call
25:01,your python function you might have this function add to order where you need two piece of information name of the item
25:08,the quantity so intent alone is not sufficient intent is what order at so using order ad maybe
25:15,you call this function in Python back and add to order and don't worry we'll add all this it will be very clear folks
25:21,if you're confused right now just hold on I will make things very very clear no rocket science here just think intent
25:28,order add means some python backend function we are calling which is add to order and as an argument it needs this
25:34,information how do you get that information you get that through entities so here power budgie is one
25:41,entity which is called food item two and one these are another quantity which is called number it's a system generated
25:48,entity in dialog flow number you can also Define custom entity you can call it okay these are quantity of food Dash
25:56,quantity okay so I think it's now clear let me give you one more example which I
26:01,have discussed in our NLP tutorial playlist before you have this particular sentence there are various entities
26:07,present here okay what are those entities if you remember from NLP playlist just pause this video and make
26:13,a guess I want to test your knowledge all right I guess you made a right guess here Elon Musk is an entity it's a
26:21,person entity Tesla is another entity which is a company then 40 could be another entity
26:27,which is a number or you have this statement for example Michael Bloomberg founded Bloomberg
26:34,so Michael Bloomberg is a person and Bloomberg is a company name we used to use this a lot whenever we discuss this
26:41,a name entity disambiguation problem it is called NAD where you have Bloomberg
26:48,founded Bloomberg so word is same Bloomberg but first one means a person second one means the entity we can say
26:56,Pandey ji founded Pandey Pandey is the name of the restaurant but the owner is
27:02,Pandey so so that's a personal entity this one is a business or a company entity
27:08,yeah so this is a playlist I was talking about if you go to YouTube another playlist uh here in this particular
27:15,video see uh we have a lot of videos where we discuss entities but uh in this
27:21,particular video we did name entity recognization and dialog flow is
27:26,internally using some of these techniques to recognize those entities once you have these entities you can
27:32,call python backend function very easy okay in the Second Use case of tracking order the 9992 number 9922 number that
27:41,you give is a order ID entity and then you're taking uh these two and calling
27:47,some python backend function saying track order and you're giving this order ID so you are kind of getting a sense of
