Time,Text
2:04:43,new function called get string from food dictionary and that food dictionary that
2:04:51,we're taking uh we're going to call that food addict which is a type hint of debt
2:04:57,and here we will use whatever chat cptq plus I made some trick here
2:05:04,so that is this and let's test this function
2:05:10,so here print let's say get Str from footbrict let's
2:05:18,say you have Samosa to foreign
2:05:32,it is putting the value here first then this then chole and then this okay
2:05:38,perfect so now let's use this function here
2:05:44,so we're going to use this function from generic helper and create that string
2:05:51,so here I think we will call that order string
2:05:57,order string is generic helper
2:06:03,and it is not a new food dictator just to be safe and secure I will just use whatever
2:06:10,the in progress ordered dictionary is giving me back when I do in progress
2:06:15,order session ID stationary is this it will return me this dictionary here
2:06:21,which I am passing it to that function and this function anyway is converting that dictionary to this string
2:06:28,and we we don't want to just set to so much of actually we want to say so far you have you know that kind of string
2:06:35,so here let me change this to so far you have
2:06:43,this order do you need anything else perfect I think it is looking good I mean if it
2:06:50,is not then it will give error and we'll figure it out so you do control as to save it
2:06:57,and let's see where we are yes it restarted it okay so now we'll go back
2:07:03,to mgrok first by the way because it might time out hey so yeah one thing
2:07:08,about ngrok you see restart and grocked if you have not created any account or anything this session will end after
2:07:16,some time so remember to restart it so I'll do Ctrl C to end that session
2:07:22,and then I will just restart it's the ngrok http
2:07:28,800. and it restarted this session and my new string is this
2:07:35,so just highlight and then write Mouse click so it will copy it and you will put it back into fulfillment
2:07:43,I mean when you are in production you don't have to do it but since this is in development we are still building we
2:07:49,have to do it if you don't want to go through all of this you have to go to and rock and I think register for an
2:07:55,account that is one way to solve it all right now I think we are good
2:08:01,okay okay let's try this I will say hey okay I will say New Order
2:08:08,what do you want to order two pizzas and one mango let's see
2:08:14,now see this is what happens so far you have two P seven mango let's see why
2:08:20,because it created this particular order let me print the whole dictionary here
2:08:27,so that you get an idea so I will print it here printed with star so that there is some
2:08:33,kind of visual indication uh review print so you get a feeling of
2:08:42,what's going on here so Ctrl s it is restarting and I will go back here reset
2:08:47,everything I'll start over say hi then New Order then I will say two Pisa one mango let's
2:08:55,see now look at this C star
2:09:02,so in progress and oh actually you know what I want to print the session ID as well
2:09:07,never mind we'll have to do it again so reset contacts do it all over again
2:09:13,hi New Order two pizza and one mango let's see
2:09:21,see this is the session ID this is the session ID that I was talking about session IDC session ID
2:09:28,then you have pizza and mangola C now when I say chole it should append to this particular dictionary so let's say
2:09:35,chole let's add some yummy chole only
2:09:44,and it will work why did it work well remember in the entities you said
2:09:56,and if you look at the dictionary now see I have chole but today here
2:10:02,and if some user from some other session makes other order it will it will maintain that okay so looks like our
2:10:11,ordering looks good now yes so I will just remove this print
2:10:18,rest because we just added it to confirm few things now we are going to look at a very interesting part which is saving
2:10:25,the order in a database once you have ordered all these you will say
2:10:30,nope that's it or complete my order because chatbot is saying so far you have two Pizza one mango let's see two
2:10:35,solo but today do you need anything else and then you will say no that's it that's it that's all I had
2:10:43,and at that time the intent that is going to be triggered
2:10:49,is this order complete context ongoing order
2:10:54,in our backend we have that particular intent mapped here to a
2:11:02,function called complete order and right now that function is empty so let's write some code for for that
2:11:09,in this function you are getting a session ID so using that session ID you need to
2:11:15,find a key in our in progress order dictionary because our in progress order dictionary looks something like this and
2:11:22,if it's session id1 then this is the order you are saving to database if it is session id2 this is the order you are
2:11:27,saying to your database so first check if session ID in in progress order
2:11:35,if it is not in uh then it means you have some problem
2:11:42,so in the Fulfillment text you will say you know what I'm having trouble finding
2:11:47,your order you need to probably place your order again because I we don't have that order due to some error or
2:11:54,something but let's say if you find that okay then
2:12:00,your order the actual food order will be this
2:12:05,and I'll just call it order so this order will get you let's say pizza mangolis Etc
2:12:11,now you have to insert this record in a database and just to make things easier uh we should
2:12:19,probably call a function called save to database let's let's create a new function called
2:12:24,save to database which looks something like this save to DB
2:12:32,order which is a dictionary all right now take a pause and let's
2:12:38,think what we need to do in this particular function let's look at our database
2:12:45,or in our database we have things like this we want to insert a next order in the orders table
2:12:53,so first thing we need is order ID so what will be the order very well what we can do is just say whatever is my Max
2:13:01,order ID add one to it that will be my next ID so max order ID is 41 so my next
2:13:07,order ID will be 41 plus 1 which is 42 and to get Max order ID you know the
2:13:13,function so select Max from orders select next
2:13:19,order ID from orders and it gives 41.
2:13:26,okay so let's let's write a function just to get the next available order ID
2:13:33,and for that also I use chat chat GPD for that and it gave me this function
2:13:39,so I copy pasted this function make sure you don't include cnx.close that's why I
2:13:45,see blindly copying from chat GPT is never going to be beneficial you have to look at the code you have to think you
2:13:52,need to have those fundamentals I know that you can't close a connection like this in the middle of the function so I
2:13:59,removed it and I created this new function let me add this new function here
2:14:07,I will call it what should we call it get next order ID Maybe
2:14:13,or get next available order order ID and that function I'm not going to write
2:14:18,the whole function because I pretty much copy paste and moved to the code from chat GPT but just to let you know
2:14:24,City selecting the Max and whatever Max you're getting it is saying that Max
2:14:30,plus one but let's say if you don't get any result let's say your order table is empty then return one okay so now we get
2:14:38,let's say the order ID what do you do next next
2:14:44,you need to insert a record here so let's say if I am ordering two Pizza
2:14:50,first thing you need to do is using Pizza string find out the item ID
2:14:56,so see Pizza string Item ID is three okay so from this derive the item ID
2:15:02,that is your first step
2:15:09,okay get Item ID which will be this once you have that
2:15:17,and now you have two pizza so see two pizzas is your input so what did you do
2:15:23,from Pizza you derive the item id which is three then in the step two I think step one is
2:15:30,really get the max ID so I'm that is Step Zero so I'm skipping that now get
2:15:37,the price get the price of two visa
2:15:44,because this is the I price for One Visa you have to get the price for two visa
2:15:50,which will be the get the price and multiply it by the quantity which is two and then you insert it here so your
2:15:56,order ID item id quantity and total price now luckily we have stored procedure in our MySQL table called get
2:16:04,price for item and if you uh look at any item see Pisa here
2:16:12,it will give you the that pizza price and then we have second
2:16:17,store procedure get total order price so that will be
2:16:23,or I think we should be looking at this insert order item so here
2:16:30,see when you say insert order item you can give food item which is pizza
2:16:36,then quantity and then order ID and the price etcetera it will retrieve on its
2:16:42,own so that this is good actually so using insert order item store
2:16:47,procedure we can insert those items here but this stored procedure is taking one
2:16:53,food item at a time we have multiple food items so we need to run some kind of for Loop here okay so go back
2:17:02,and in the save to database function we have
2:17:09,order so this order order can be
2:17:16,Pizza 2 so lay one it could be this kind of dictionary we need to insert these items
2:17:25,one by one and the way you do that is you write a for Loop you will say for food item
2:17:33,quantity in order dot items
2:17:40,when you do this on a dictionary you will get food item and the quantity and then you will insert so now
2:17:47,in our DB helper we need to pop we need to add one method called insert
2:17:53,order item let's say we have a method called insert order item where you can supply food item you can supply quantity
2:18:02,and you supply next order ID then this will work so how to get next
2:18:08,order ID by the way we have that function already so D we offer
2:18:15,dot get next order ID and that is your next order ID
2:18:22,so that part is taken care of but we need to write this function
2:18:27,insert order item so I'll go here I'll create a new function here
2:18:34,death insert order item and that method is
2:18:42,taking three parameters these three okay
2:18:49,once again I use chat dpd and say that I have this kind of store procedure just
2:18:55,write me a function and it it wrote me a nice beautiful function which I am going
2:19:00,to copy paste here see it is calling the insert order item
2:19:08,store procedure this is how you call it and if the order is not successfully reply
2:19:13,uh placed you roll back and you do it uh you know printing Etc
2:19:19,okay so this thing is done now let's come back to this function so here now
2:19:26,that you have insert order item I want to check the return code here because
2:19:33,it might return -1 which is not good anyway if it returns minus one then you
2:19:39,know if let's say you have any database error I will return minus one from here too and
2:19:47,we'll order we will handle this thing in save to
2:19:53,database function so we will do that but for now let's say everything worked okay
2:19:58,at that time uh at that time we are pretty much done
2:20:04,and we can return that that order ID that order ID back to this function so
2:20:10,here this will be order ID okay so let's say I saved my record in a
2:20:17,database I can say hey your order is placed uh here is your
2:20:24,order ID okay or here is your order total actually order total is also is
2:20:30,something you need to mention but let's first handle order ID Okay order ID by
2:20:35,the way can be minus 1 which indicates the database error in that case you can
2:20:41,say if order ID is equal to minus 1. then you can return some
2:20:49,message saying that sorry I could not reply I could not place your order try it again but if it plays the order then
2:20:58,you will say awesome I have placed your order this is the order ID okay and you are also going to say order
2:21:05,total so how do you get order total where for order total wouldn't it be
2:21:10,nice if you have a function in our DB helper which says okay get total order
2:21:17,price and you just give order ID luckily we have the stored procedure for
2:21:24,such a function so here if you say get
2:21:29,actually get price for the item and get total price yes
2:21:36,okay so for order ID 40 let's say total price is 12 and 8. 20 so if I say 40
2:21:43,here said is giving me 20. so we already have a stored procedure which we can call
2:21:48,okay so I will say get total order price so I talked to chat GPT and I said I
2:21:54,have a store procedure called get total order price where I give order ID can you write a python code for me
2:22:02,and it's not very surprising it showed a nice python code which looks something
2:22:10,like this let me just uh show that code it to you
2:22:16,so that code looks something like this you take order ID you select
2:22:22,uh this is where you're calling that user defined function by the way it's not a store procedure it's a user
2:22:27,defined function that I'm calling and very straightforward function it will return the total order price
2:22:34,and once again you can use that if under the underscore name is equal to main to
2:22:40,test that particular function okay I got the order total what do I do
2:22:47,next now okay I have ordered total all of my fulfillment text looks good I can return
2:22:54,that okay I can return it perfect but we need
2:22:59,to do one more thing when an order is placed
2:23:05,let's say this order is placed we need to remove this record from our in
2:23:10,progress order otherwise it will mess things up and to remove that we can use this
2:23:17,function called Del so if you do that it will remove
2:23:23,that that whole thing from our dictionary okay now let's go back to our
2:23:30,database and let's think one more time if we are completing everything so let's say incoming order came in you placed
2:23:37,let's say it was pizza you you inserted two two records order ID will be same 42
2:23:43,so 40 to 42 and the pizza and should I go to the record okay so that's it but
2:23:49,we have another table called order tracking so here also we need to insert a record remember when order is placed
2:23:55,the order should also go into order tracking and we can just say this is in
2:24:00,progress Etc so let's do that one last piece and that
2:24:06,will come in save to DB function by the way because save to DB is the function which
2:24:11,kind of saves everything to our database and here it will be my wish that my DB helper
2:24:20,has a routine call insert order tracking
2:24:26,where I insert my next order ID and let's say the status I want to insert is
2:24:32,in progress so I want to have this function which takes order ID in progress and all it
2:24:38,will do is it will insert less order ID and this is the status progress or status correct and I used
2:24:46,uh chat GPT once again to kind of write that function so I'm
2:24:51,just gonna copy paste folks I know it's lot of coding so I want to save your time you are given all this code so take
2:24:58,your time to digest this this is a long tutorial I understand folks but we are building end to end serious project here
2:25:04,so obviously you need to help patients Whoever has patience and completes this
2:25:10,till the end is the person who is going to get maximum benefit out of this
2:25:15,okay so now inserted so the order is inserted into order tracking
2:25:24,table as well looks like we have done most of the
2:25:29,things uh that could be an error I don't know so I will just restart my server
2:25:35,and I will now do the true end-to-end test so let's try everything once again I
2:25:43,will say hi Place me New Order what do you want to order two
2:25:49,pizzas and one mango let's see it it has that in our in progress order
2:25:55,dictionary you will say nope that's it and see it placed an order the order ID
2:26:04,is 42 the total is 21 let's verify it in our database so right now database has
2:26:10,only two orders see 40 and 41 1441 in both the tables now let's run it
2:26:18,again 42 see this is 42 folks this is what we
2:26:24,ordered just now and same thing here 42 in progress see
2:26:29,and the total is 16 and 5 21. so our chatbot is saying 21 which is correct
2:26:38,and you placed I think two Pizza one sholay whatever perfect
2:26:44,so now if this is like end to end tested you can also Place New Order and test
2:26:51,that scenario where you know you are adding more and more items so let's say add two mangola c and
2:27:00,or you can say add one word up
2:27:06,so two mango let's see two shoulders and you can say now complete the order
2:27:11,and you will say we have placed your order 43 see order number 43 should have
2:27:17,three items let's go back here 43 you see it has three items
2:27:26,amazing let me go over that session ID logic so that there is no confusion left
2:27:31,in production there will be multiple chat windows and the server the first
2:27:36,API backend that we are writing there could be multiple servers that we can deploy to our cloud provider it could be
2:27:43,AWS gcp Etc and one server will be receiving requests from multiple chat
2:27:49,Windows opening at the same time so let's say server one receives two chat windows at the same time the first
2:27:56,person says add five solar battery in the back end we will add session ID for
2:28:02,that session and we will say chole file order then they can say oh can you also add
2:28:09,one word upon and in that same session ID we will add a Vada
2:28:14,at the same time other person might start a chat say New Order now in this
2:28:20,in New Order we don't need to do anything but when they say I need two P's and one plate Samosa we will add
2:28:26,session ID 2 in our dictionary and we'll add two pizza and one samosa
2:28:32,so just pause this video and just visualize this picture you your understanding will be very very clear
2:28:37,chat window there is a session ID and the order for that session is stored as
2:28:43,a value for that key in the dictionary now this person will say complete my
2:28:49,order so we'll save the record in database and we will remove the session IDC session ID one is gone here see it
2:28:56,was there before but when this says complete at that time we remove the
2:29:02,session ID and this person can continue having a conversation and that was the reason in
2:29:09,our code you noticed we deleted that particular key so if you
2:29:16,see that delete code that we wrote uh where is it yes see this delete line
2:29:25,we wrote because once the order is saved to a database we want to remove it from
2:29:30,the dictionary now let's move on to our last piece which is the remove okay so we have handled most
2:29:38,of uh the intentions and now the only intention that is remaining is order dot
2:29:43,remove okay so let me comment this code and we are going to write this remove from order function
2:29:49,this function will be actually simple uh when you're having a conversation say add to whatever one mango let's say this
2:29:57,happens in real life person might say oh you know what please remove mango or say I don't want to order that they just
2:30:03,change their mind while they are on the call same thing in NLP chatbot they will remove some items at any point of time
2:30:10,so what we need to do is let's say for session id2 right now it is word upon mangulasi and if that person says remove
2:30:18,mango let's see what do we need to do step by step step one is locate
2:30:25,this session ID record okay so that's session ID let's say if it is session
2:30:31,id2 that record will be this once you locate it step number two
2:30:39,is get the key from the dictionary get the value from the dictionary actually value
2:30:45,from debt which is actually this so like locate the session record will be this
2:30:50,whole thing and then when you locate the value from the deck it will be this
2:30:55,dictionary and step number three will be remove the four items that you are
2:31:02,asking to remove now in the request you will receive an array of food items that
2:31:07,you want to remove you will receive so let's say whatever you might uh receive multiple items so
2:31:14,let's say in your order there is pizza as well okay I'm just adding one more
2:31:19,item to make it clear and if the person says remove Vada pav and pizza
2:31:25,now what we need to do is we need to either through this array and we need to also enter through the
2:31:33,keys in this particular dictionary and remove those key value pairs so that is
2:31:39,the simple logic that we are going to follow here so let's go back to the
2:31:45,python code and first thing obviously we are going to check if whether this
2:31:50,session ID exists or not okay so you will say if session ID not in in
2:31:58,progress order see if the if it is not there then there is some error condition and you
2:32:03,can tell to the user that looks some error happen buddy sorry you need to
2:32:09,place a new order but let's say if session ID is there then you need to stationary there is
2:32:17,meaning let's say this is a session ID so you need to locate this order so this order is what in progress order in
2:32:24,bracket session ID so let's do that so in progress order okay
2:32:29,and session ID this will give you this particular record so let's store this
2:32:34,record in a variable called current order so this current order once again is this
2:32:41,particular dictionary and you want to get from the request the items which are
2:32:47,being removed let's say Vodafone and pizza is being removed let me add pizza here just to make this picture complete
2:32:55,so that food items will be coming from
2:33:00,parameters okay and the parameters it will be food
2:33:05,item we will see in the dialog flow how this works but the parameter name is is essentially food items so now you are
2:33:13,going through all those four items so let's say I'm going through Vada power and Pisa so first I get what about and
2:33:20,that whatever you look into this particular dictionary which is your current order so you will say if item
2:33:28,first you want to check see let's say Vada power might not be there because of some error someone said let's say those
2:33:34,are here well you're trying to remove don'tsa from this order which doesn't have the answer that's an error
2:33:39,condition so you need to handle it uh the way we are going to handle it is we'll say if item not in current order
2:33:46,do something we'll worry about that later but let's say if it is in current items okay you
2:33:54,will delete from that current order you will delete it
2:34:00,you will delete what item that's it so you needed it from the item
2:34:05,and then you will say Okay item is removed blah blah blah but there could be scenarios where as we saw in if
2:34:13,condition item is not there so you want to kind of track which items are removed and which items do not exist
2:34:20,so for that I will create an array called remove items so whenever
2:34:25,item gets removed I want to track which items got removed okay so I will just
2:34:31,put that in one list and the items which are not removed which we did not find
2:34:38,will say no such items so no such items no such items dot append item when we
2:34:46,are done with this for Loop we know which items were removed from the order which items did not exist and the way we
2:34:52,can utilize this information is we can say if Lan of removed item is greater than zero
2:34:58,meaning we removed some items then we will say my fulfillment text is equal to
2:35:06,its form string we will say V remote XYZ items from your order that message will
2:35:13,send back to the user so that we can display it in our chat window if length
2:35:19,of No Such item let's say you did not find some items so here in our case if
2:35:24,we say remove Vada Point Pisa unless if we said not what about pizza but let's
2:35:29,say now it will be able to remove whatever so the message should say removed
2:35:41,from order and the other one is no
2:35:46,item or let's say not found in your order you want to just
2:35:54,be very very clear so here you are saying which items were removed here you are saying which items
2:36:02,so if length of No Such items is greater than zero then from current order your
2:36:08,current order let's say does not have these items this is the message that we want to pass
2:36:15,and if length of current order dot keys
2:36:23,is equal to 0 which means your order is essentially empty let's say a current order here
2:36:32,due to some reason I don't know what could be that reason unless it's blank it means you have an empty order
2:36:38,so you want to display that as well well after sorry after removing it after
2:36:45,removing the item let's say your order is blank okay so let's say you had only
2:36:51,this thing one thing whatever and you remove it upon so your order is blank
2:36:58,okay uh we will also have as condition your order does is not blank so you want to
2:37:04,display which items are remaining in the order so what items are remaining what
2:37:10,whatever is your current order this current order those are the items remaining right so how do you convert
2:37:16,this current uh order into a string format so we already wrote this function called get string from foot dick so
2:37:24,we'll use we will just use that function few minutes back so the same function we
2:37:30,are going to use here and say your uh okay
2:37:37,and this is generic helper so from generic helper call this function get
